Enter password: **********
Welcome to the MySQL monitor.  Commands end with ; or \g.
Your MySQL connection id is 12
Server version: 8.0.43 MySQL Community Server - GPL

Copyright (c) 2000, 2025, Oracle and/or its affiliates.

Oracle is a registered trademark of Oracle Corporation and/or its
affiliates. Other names may be trademarks of their respective
owners.

Type 'help;' or '\h' for help. Type '\c' to clear the current input statement.

mysql> drop database bank1;
Query OK, 6 rows affected (0.26 sec)

mysql> create database Bank;
Query OK, 1 row affected (0.00 sec)

mysql> use Bank;
Database changed
mysql>
mysql> CREATE TABLE account(
    ->  account_number BIGINT PRIMARY KEY,
    ->  branch_name varchar(10),
    ->  balance int(10)
    -> );
Query OK, 0 rows affected, 1 warning (0.02 sec)

mysql>
mysql> CREATE TABLE branch(
    ->  branch_name varchar(10) PRIMARY KEY,
    ->  branch_city varchar(10) DEFAULT 'PUNE',
    ->  assets BIGINT
    -> );
Query OK, 0 rows affected (0.01 sec)

mysql>
mysql> CREATE TABLE customer(
    ->  cust_name varchar(20) PRIMARY KEY,
    ->  cust_street varchar(15),
    ->  cust_city varchar(10)
    -> );
Query OK, 0 rows affected (0.01 sec)

mysql>
mysql> CREATE TABLE loan(
    ->  loan_no BIGINT PRIMARY KEY,
    ->  branch_name varchar(10),
    ->  amount int(8)
    -> );
Query OK, 0 rows affected, 1 warning (0.01 sec)

mysql>
mysql> CREATE TABLE depositor(
    ->  cust_name varchar(20),
    ->  account_number BIGINT,
    ->  FOREIGN KEY (cust_name) REFERENCES customer(cust_name),
    ->  FOREIGN KEY (account_number) REFERENCES account(account_number)
    -> );
Query OK, 0 rows affected (0.03 sec)

mysql>
mysql> CREATE TABLE borrower(
    ->  cust_name varchar(20),
    ->  loan_no BIGINT,
    ->  FOREIGN KEY (cust_name) REFERENCES customer(cust_name),
    ->  FOREIGN KEY (loan_no) REFERENCES loan(loan_no)
    -> );
Query OK, 0 rows affected (0.03 sec)

mysql>
mysql> ALTER TABLE account
    ->  ADD FOREIGN KEY (branch_name)
    ->  REFERENCES branch(branch_name);
Query OK, 0 rows affected (0.05 sec)
Records: 0  Duplicates: 0  Warnings: 0

mysql>
mysql> ALTER TABLE loan
    ->  ADD FOREIGN KEY (branch_name)
    ->  REFERENCES branch(branch_name);
Query OK, 0 rows affected (0.04 sec)
Records: 0  Duplicates: 0  Warnings: 0

mysql>
mysql> desc account;
+----------------+-------------+------+-----+---------+-------+
| Field          | Type        | Null | Key | Default | Extra |
+----------------+-------------+------+-----+---------+-------+
| account_number | bigint      | NO   | PRI | NULL    |       |
| branch_name    | varchar(10) | YES  | MUL | NULL    |       |
| balance        | int         | YES  |     | NULL    |       |
+----------------+-------------+------+-----+---------+-------+
3 rows in set (0.02 sec)

mysql> desc branch;
+-------------+-------------+------+-----+---------+-------+
| Field       | Type        | Null | Key | Default | Extra |
+-------------+-------------+------+-----+---------+-------+
| branch_name | varchar(10) | NO   | PRI | NULL    |       |
| branch_city | varchar(10) | YES  |     | PUNE    |       |
| assets      | bigint      | YES  |     | NULL    |       |
+-------------+-------------+------+-----+---------+-------+
3 rows in set (0.00 sec)

mysql> desc customer;
+-------------+-------------+------+-----+---------+-------+
| Field       | Type        | Null | Key | Default | Extra |
+-------------+-------------+------+-----+---------+-------+
| cust_name   | varchar(20) | NO   | PRI | NULL    |       |
| cust_street | varchar(15) | YES  |     | NULL    |       |
| cust_city   | varchar(10) | YES  |     | NULL    |       |
+-------------+-------------+------+-----+---------+-------+
3 rows in set (0.00 sec)

mysql> desc loan;
+-------------+-------------+------+-----+---------+-------+
| Field       | Type        | Null | Key | Default | Extra |
+-------------+-------------+------+-----+---------+-------+
| loan_no     | bigint      | NO   | PRI | NULL    |       |
| branch_name | varchar(10) | YES  | MUL | NULL    |       |
| amount      | int         | YES  |     | NULL    |       |
+-------------+-------------+------+-----+---------+-------+
3 rows in set (0.00 sec)

mysql> desc depositor;
+----------------+-------------+------+-----+---------+-------+
| Field          | Type        | Null | Key | Default | Extra |
+----------------+-------------+------+-----+---------+-------+
| cust_name      | varchar(20) | YES  | MUL | NULL    |       |
| account_number | bigint      | YES  | MUL | NULL    |       |
+----------------+-------------+------+-----+---------+-------+
2 rows in set (0.00 sec)

mysql> desc borrower;
+-----------+-------------+------+-----+---------+-------+
| Field     | Type        | Null | Key | Default | Extra |
+-----------+-------------+------+-----+---------+-------+
| cust_name | varchar(20) | YES  | MUL | NULL    |       |
| loan_no   | bigint      | YES  | MUL | NULL    |       |
+-----------+-------------+------+-----+---------+-------+
2 rows in set (0.00 sec)

mysql>
mysql> INSERT INTO branch
    ->  VALUES("SUNCITY", "PUNE", 100000000);
Query OK, 1 row affected (0.00 sec)

mysql>
mysql> INSERT INTO account
    ->  VALUES(345243200001, "SUNCITY", 90031),
    ->  (345243200002, "SUNCITY", 589224),
    ->  (345243200003, "SUNCITY", 7998),
    ->  (345243200004, "SUNCITY", 125448),
    ->  (345243200005, "SUNCITY", 21542);
Query OK, 5 rows affected (0.00 sec)
Records: 5  Duplicates: 0  Warnings: 0

mysql>
mysql> INSERT INTO customer
    ->  VALUES("Ved", "Suncity", "Pune"),
    ->  ("Atrava", "Wadia", "Pune"),
    ->  ("Aditya", "KasbaPeth", "Pune"),
    ->  ("Manavi", "Gulhmore", "Pune"),
    ->  ("Harsh", "Koregoan", "Pune");
Query OK, 5 rows affected (0.00 sec)
Records: 5  Duplicates: 0  Warnings: 0

mysql>
mysql> INSERT INTO loan
    ->  VALUES(10992001, "SUNCITY", 15000),
    ->  (10992002, "SUNCITY", 70000),
    ->  (10992003, "SUNCITY", 643000);
Query OK, 3 rows affected (0.00 sec)
Records: 3  Duplicates: 0  Warnings: 0

mysql>
mysql> INSERT INTO depositor
    ->  VALUES("Ved", 345243200001),
    ->  ("Atrava", 345243200002),
    ->  ("Aditya", 345243200003),
    ->  ("Manavi", 345243200004),
    ->  ("Harsh", 345243200005);
Query OK, 5 rows affected (0.00 sec)
Records: 5  Duplicates: 0  Warnings: 0

mysql>
mysql> INSERT INTO borrower
    ->  VALUES("Ved", 10992001),
    ->  ("Manavi", 10992002),
    ->  ("Atrava", 10992003);
Query OK, 3 rows affected (0.00 sec)
Records: 3  Duplicates: 0  Warnings: 0

mysql>
mysql> SELECT * FROM branch;
+-------------+-------------+-----------+
| branch_name | branch_city | assets    |
+-------------+-------------+-----------+
| SUNCITY     | PUNE        | 100000000 |
+-------------+-------------+-----------+
1 row in set (0.00 sec)

mysql> SELECT * FROM account;
+----------------+-------------+---------+
| account_number | branch_name | balance |
+----------------+-------------+---------+
|   345243200001 | SUNCITY     |   90031 |
|   345243200002 | SUNCITY     |  589224 |
|   345243200003 | SUNCITY     |    7998 |
|   345243200004 | SUNCITY     |  125448 |
|   345243200005 | SUNCITY     |   21542 |
+----------------+-------------+---------+
5 rows in set (0.00 sec)

mysql> SELECT * FROM customer;
+-----------+-------------+-----------+
| cust_name | cust_street | cust_city |
+-----------+-------------+-----------+
| Aditya    | KasbaPeth   | Pune      |
| Atrava    | Wadia       | Pune      |
| Harsh     | Koregoan    | Pune      |
| Manavi    | Gulhmore    | Pune      |
| Ved       | Suncity     | Pune      |
+-----------+-------------+-----------+
5 rows in set (0.00 sec)

mysql> SELECT * FROM loan;
+----------+-------------+--------+
| loan_no  | branch_name | amount |
+----------+-------------+--------+
| 10992001 | SUNCITY     |  15000 |
| 10992002 | SUNCITY     |  70000 |
| 10992003 | SUNCITY     | 643000 |
+----------+-------------+--------+
3 rows in set (0.00 sec)

mysql> SELECT * FROM depositor;
+-----------+----------------+
| cust_name | account_number |
+-----------+----------------+
| Ved       |   345243200001 |
| Atrava    |   345243200002 |
| Aditya    |   345243200003 |
| Manavi    |   345243200004 |
| Harsh     |   345243200005 |
+-----------+----------------+
5 rows in set (0.00 sec)

mysql> SELECT * FROM borrower;
+-----------+----------+
| cust_name | loan_no  |
+-----------+----------+
| Ved       | 10992001 |
| Manavi    | 10992002 |
| Atrava    | 10992003 |
+-----------+----------+
3 rows in set (0.00 sec)

mysql>
mysql> INSERT INTO branch
    ->  VALUES("AKRUDI", "PUNE", 50000000);
Query OK, 1 row affected (0.00 sec)

mysql>
mysql> INSERT INTO account
    ->  VALUES(345242300001, "AKRUDI", 979031),
    ->  (345242300002, "AKRUDI", 58924),
    ->  (345242300003, "AKRUDI", 688),
    ->  (345242300004, "AKRUDI", 1848),
    ->  (345242300005, "AKRUDI", 97542);
Query OK, 5 rows affected (0.00 sec)
Records: 5  Duplicates: 0  Warnings: 0

mysql>
mysql> INSERT INTO customer
    ->  VALUES("Tejas", "Akurdi", "Pune"),
    ->  ("Chitanaya", "ShinwarPeth", "Pune"),
    ->  ("Vaibhav", "Yerawada", "Pune"),
    ->  ("Rushi", "Nanded", "Pune"),
    ->  ("Sartak", "FC", "Pune");
Query OK, 5 rows affected (0.00 sec)
Records: 5  Duplicates: 0  Warnings: 0

mysql>
mysql> INSERT INTO loan
    ->  VALUES(10994001, "AKRUDI", 7500),
    ->  (10994002, "AKRUDI", 980000),
    ->  (10994003, "AKRUDI", 4500);
Query OK, 3 rows affected (0.00 sec)
Records: 3  Duplicates: 0  Warnings: 0

mysql>
mysql> INSERT INTO depositor
    ->  VALUES("Tejas", 345242300001),
    ->  ("Chitanaya", 345242300002),
    ->  ("Vaibhav", 345242300003),
    ->  ("Rushi", 345242300004),
    ->  ("Sartak", 345242300005);
Query OK, 5 rows affected (0.00 sec)
Records: 5  Duplicates: 0  Warnings: 0

mysql>
mysql> INSERT INTO borrower
    ->  VALUES("Chitanaya", 10994001),
    ->  ("Vaibhav", 10994002),
    ->  ("Tejas", 10994003);
Query OK, 3 rows affected (0.00 sec)
Records: 3  Duplicates: 0  Warnings: 0

mysql>
mysql> INSERT INTO branch
    ->  VALUES("BANDRA", "MUMBAI", 200000000),
    ->  ("ANDHERI", "MUMBAI", 150000000);
Query OK, 2 rows affected (0.00 sec)
Records: 2  Duplicates: 0  Warnings: 0

mysql>
mysql> INSERT INTO customer
    ->  VALUES("Priya", "Marine Drive", "Mumbai"),
    ->  ("Rohit", "Bandra West", "Mumbai"),
    ->  ("Pooja", "Andheri East", "Mumbai"),
    ->  ("Prasad", "Worli", "Mumbai"),
    ->  ("Sneha", "Powai", "Mumbai"),
    ->  ("Rajesh", "Thane", "Mumbai");
Query OK, 6 rows affected (0.00 sec)
Records: 6  Duplicates: 0  Warnings: 0

mysql>
mysql> INSERT INTO account
    ->  VALUES(345245600001, "BANDRA", 45000),
    ->  (345245600002, "BANDRA", 78000),
    ->  (345245600003, "ANDHERI", 12500),
    ->  (345245600004, "ANDHERI", 95000),
    ->  (345245600005, "BANDRA", 156000),
    ->  (345245600006, "ANDHERI", 8500);
Query OK, 6 rows affected (0.00 sec)
Records: 6  Duplicates: 0  Warnings: 0

mysql>
mysql> INSERT INTO loan
    ->  VALUES(10995001, "BANDRA", 1400),
    ->  (10995002, "BANDRA", 25000),
    ->  (10995003, "ANDHERI", 1350),
    ->  (10995004, "ANDHERI", 45000),
    ->  (10995005, "AKRUDI", 13500);
Query OK, 5 rows affected (0.00 sec)
Records: 5  Duplicates: 0  Warnings: 0

mysql>
mysql> INSERT INTO depositor
    ->  VALUES("Priya", 345245600001),
    ->  ("Rohit", 345245600002),
    ->  ("Pooja", 345245600003),
    ->  ("Prasad", 345245600004),
    ->  ("Sneha", 345245600005),
    ->  ("Rajesh", 345245600006);
Query OK, 6 rows affected (0.00 sec)
Records: 6  Duplicates: 0  Warnings: 0

mysql>
mysql> INSERT INTO borrower
    ->  VALUES("Priya", 10995001),
    ->  ("Rohit", 10995002),
    ->  ("Pooja", 10995003),
    ->  ("Prasad", 10995004),
    ->  ("Rushi", 10995005);
Query OK, 5 rows affected (0.00 sec)
Records: 5  Duplicates: 0  Warnings: 0

mysql>
mysql> -- 1. Find the names of all branches in loan relation.
mysql> SELECT branch_name
    ->  FROM loan;
+-------------+
| branch_name |
+-------------+
| AKRUDI      |
| AKRUDI      |
| AKRUDI      |
| AKRUDI      |
| ANDHERI     |
| ANDHERI     |
| BANDRA      |
| BANDRA      |
| SUNCITY     |
| SUNCITY     |
| SUNCITY     |
+-------------+
11 rows in set (0.00 sec)

mysql>
mysql> -- 2. Find all loan numbers for loans made at Akurdi Branch with loan amount > 12000.
mysql> SELECT loan_no
    ->  FROM loan
    ->  WHERE amount > 12000 AND branch_name = "AKRUDI";
+----------+
| loan_no  |
+----------+
| 10994002 |
| 10995005 |
+----------+
2 rows in set (0.00 sec)

mysql>
mysql> -- 3. Find all customers who have a loan from bank. Find their names, loan_no and loan amount.
mysql> SELECT loan.loan_no, loan.amount, borrower.cust_name
    ->  FROM loan, borrower
    ->  WHERE loan.loan_no = borrower.loan_no;
+----------+--------+-----------+
| loan_no  | amount | cust_name |
+----------+--------+-----------+
| 10992001 |  15000 | Ved       |
| 10992002 |  70000 | Manavi    |
| 10992003 | 643000 | Atrava    |
| 10994001 |   7500 | Chitanaya |
| 10994002 | 980000 | Vaibhav   |
| 10994003 |   4500 | Tejas     |
| 10995001 |   1400 | Priya     |
| 10995002 |  25000 | Rohit     |
| 10995003 |   1350 | Pooja     |
| 10995004 |  45000 | Prasad    |
| 10995005 |  13500 | Rushi     |
+----------+--------+-----------+
11 rows in set (0.00 sec)

mysql>
mysql> -- 4. List all customers in alphabetical order who have loan from Akurdi branch.
mysql> SELECT borrower.cust_name
    ->  FROM borrower, loan
    ->  WHERE loan.branch_name = "AKRUDI" AND loan.loan_no = borrower.loan_no
    ->  ORDER BY cust_name ASC;
+-----------+
| cust_name |
+-----------+
| Chitanaya |
| Rushi     |
| Tejas     |
| Vaibhav   |
+-----------+
4 rows in set (0.00 sec)

mysql>
mysql> -- 5. Find all customers who have an account or loan or both at bank.
mysql> SELECT cust_name FROM depositor
    -> UNION
    -> SELECT cust_name FROM borrower;
+-----------+
| cust_name |
+-----------+
| Aditya    |
| Atrava    |
| Chitanaya |
| Harsh     |
| Manavi    |
| Pooja     |
| Prasad    |
| Priya     |
| Rajesh    |
| Rohit     |
| Rushi     |
| Sartak    |
| Sneha     |
| Tejas     |
| Vaibhav   |
| Ved       |
+-----------+
16 rows in set (0.00 sec)

mysql>
mysql> -- 6. Find all customers who have both account and loan at bank.
mysql> SELECT depositor.cust_name
    ->  FROM depositor, borrower
    ->  WHERE depositor.cust_name = borrower.cust_name;
+-----------+
| cust_name |
+-----------+
| Atrava    |
| Chitanaya |
| Manavi    |
| Pooja     |
| Prasad    |
| Priya     |
| Rohit     |
| Rushi     |
| Tejas     |
| Vaibhav   |
| Ved       |
+-----------+
11 rows in set (0.00 sec)

mysql>
mysql> -- 7. Find all customers who have account but no loan at the bank.
mysql> SELECT cust_name
    ->  FROM depositor
    ->  WHERE cust_name NOT IN (SELECT cust_name FROM borrower);
+-----------+
| cust_name |
+-----------+
| Aditya    |
| Harsh     |
| Rajesh    |
| Sartak    |
| Sneha     |
+-----------+
5 rows in set (0.00 sec)

mysql>
mysql> -- 8. Find the average account balance at each branch.
mysql> SELECT branch_name, AVG(balance)
    ->  FROM account
    ->  GROUP BY branch_name;
+-------------+--------------+
| branch_name | AVG(balance) |
+-------------+--------------+
| AKRUDI      |  227606.6000 |
| ANDHERI     |   38666.6667 |
| BANDRA      |   93000.0000 |
| SUNCITY     |  166848.6000 |
+-------------+--------------+
4 rows in set (0.00 sec)

mysql>
mysql> -- 9. Find no. of depositors at each branch.
mysql> SELECT COUNT(depositor.account_number) AS num_depositors, account.branch_name
    ->  FROM depositor, account
    ->  WHERE depositor.account_number = account.account_number
    ->  GROUP BY account.branch_name;
+----------------+-------------+
| num_depositors | branch_name |
+----------------+-------------+
|              5 | AKRUDI      |
|              5 | SUNCITY     |
|              3 | BANDRA      |
|              3 | ANDHERI     |
+----------------+-------------+
4 rows in set (0.00 sec)

mysql>
mysql> -- 10. Find name of Customer and city where customer name starts with Letter P.
mysql> SELECT cust_name, cust_city
    ->  FROM customer
    ->  WHERE cust_name LIKE "P%";
+-----------+-----------+
| cust_name | cust_city |
+-----------+-----------+
| Pooja     | Mumbai    |
| Prasad    | Mumbai    |
| Priya     | Mumbai    |
+-----------+-----------+
3 rows in set (0.00 sec)

mysql>
mysql> -- 11. Display distinct cities of branch.
mysql> SELECT DISTINCT branch_city
    ->  FROM branch;
+-------------+
| branch_city |
+-------------+
| PUNE        |
| MUMBAI      |
+-------------+
2 rows in set (0.00 sec)

mysql>
mysql> -- 12. Find the branches where average account balance > 12000.
mysql> SELECT branch_name, AVG(balance) AS avg_balance
    ->  FROM account
    ->  GROUP BY branch_name
    ->  HAVING AVG(balance) > 12000;
+-------------+-------------+
| branch_name | avg_balance |
+-------------+-------------+
| AKRUDI      | 227606.6000 |
| ANDHERI     |  38666.6667 |
| BANDRA      |  93000.0000 |
| SUNCITY     | 166848.6000 |
+-------------+-------------+
4 rows in set (0.00 sec)

mysql>
mysql> -- 13. Find number of tuples in customer relation.
mysql> SELECT COUNT(*) AS total_customers
    ->  FROM customer;
+-----------------+
| total_customers |
+-----------------+
|              16 |
+-----------------+
1 row in set (0.01 sec)

mysql>
mysql> -- 14. Calculate total loan amount given by bank.
mysql> SELECT SUM(amount) AS total_loan_amount
    ->  FROM loan;
+-------------------+
| total_loan_amount |
+-------------------+
|           1806250 |
+-------------------+
1 row in set (0.00 sec)

mysql>
mysql> -- 15. Delete all loans with loan amount between 1300 and 1500.
mysql> DELETE borrower FROM borrower
    -> JOIN loan ON borrower.loan_no = loan.loan_no
    -> WHERE loan.amount BETWEEN 1300 AND 1500;
Query OK, 2 rows affected (0.00 sec)

mysql>
mysql> DELETE FROM loan
    -> WHERE amount BETWEEN 1300 AND 1500;
Query OK, 2 rows affected (0.00 sec)

mysql>
mysql> -- 16. Delete all tuples at every branch located in Mumbai.
mysql> DELETE depositor FROM depositor
    -> JOIN account ON depositor.account_number = account.account_number
    -> JOIN branch ON account.branch_name = branch.branch_name
    -> WHERE branch.branch_city = 'MUMBAI';
Query OK, 6 rows affected (0.00 sec)

mysql>
mysql> DELETE borrower FROM borrower
    -> JOIN loan ON borrower.loan_no = loan.loan_no
    -> JOIN branch ON loan.branch_name = branch.branch_name
    -> WHERE branch.branch_city = 'MUMBAI';
Query OK, 2 rows affected (0.00 sec)

mysql>
mysql> DELETE FROM account
    -> WHERE branch_name IN (SELECT branch_name FROM branch WHERE branch_city = 'MUMBAI');
Query OK, 6 rows affected (0.00 sec)

mysql>
mysql> DELETE FROM loan
    -> WHERE branch_name IN (SELECT branch_name FROM branch WHERE branch_city = 'MUMBAI');
Query OK, 2 rows affected (0.00 sec)

mysql>
mysql> DELETE FROM branch
    -> WHERE branch_city = 'MUMBAI';
Query OK, 2 rows affected (0.00 sec)

mysql>
mysql> SELECT * FROM branch;
+-------------+-------------+-----------+
| branch_name | branch_city | assets    |
+-------------+-------------+-----------+
| AKRUDI      | PUNE        |  50000000 |
| SUNCITY     | PUNE        | 100000000 |
+-------------+-------------+-----------+
2 rows in set (0.00 sec)

mysql> SELECT * FROM account;
+----------------+-------------+---------+
| account_number | branch_name | balance |
+----------------+-------------+---------+
|   345242300001 | AKRUDI      |  979031 |
|   345242300002 | AKRUDI      |   58924 |
|   345242300003 | AKRUDI      |     688 |
|   345242300004 | AKRUDI      |    1848 |
|   345242300005 | AKRUDI      |   97542 |
|   345243200001 | SUNCITY     |   90031 |
|   345243200002 | SUNCITY     |  589224 |
|   345243200003 | SUNCITY     |    7998 |
|   345243200004 | SUNCITY     |  125448 |
|   345243200005 | SUNCITY     |   21542 |
+----------------+-------------+---------+
10 rows in set (0.00 sec)

mysql> SELECT * FROM customer;
+-----------+--------------+-----------+
| cust_name | cust_street  | cust_city |
+-----------+--------------+-----------+
| Aditya    | KasbaPeth    | Pune      |
| Atrava    | Wadia        | Pune      |
| Chitanaya | ShinwarPeth  | Pune      |
| Harsh     | Koregoan     | Pune      |
| Manavi    | Gulhmore     | Pune      |
| Pooja     | Andheri East | Mumbai    |
| Prasad    | Worli        | Mumbai    |
| Priya     | Marine Drive | Mumbai    |
| Rajesh    | Thane        | Mumbai    |
| Rohit     | Bandra West  | Mumbai    |
| Rushi     | Nanded       | Pune      |
| Sartak    | FC           | Pune      |
| Sneha     | Powai        | Mumbai    |
| Tejas     | Akurdi       | Pune      |
| Vaibhav   | Yerawada     | Pune      |
| Ved       | Suncity      | Pune      |
+-----------+--------------+-----------+
16 rows in set (0.00 sec)

mysql> SELECT * FROM loan;
+----------+-------------+--------+
| loan_no  | branch_name | amount |
+----------+-------------+--------+
| 10992001 | SUNCITY     |  15000 |
| 10992002 | SUNCITY     |  70000 |
| 10992003 | SUNCITY     | 643000 |
| 10994001 | AKRUDI      |   7500 |
| 10994002 | AKRUDI      | 980000 |
| 10994003 | AKRUDI      |   4500 |
| 10995005 | AKRUDI      |  13500 |
+----------+-------------+--------+
7 rows in set (0.00 sec)

mysql> SELECT * FROM depositor;
+-----------+----------------+
| cust_name | account_number |
+-----------+----------------+
| Ved       |   345243200001 |
| Atrava    |   345243200002 |
| Aditya    |   345243200003 |
| Manavi    |   345243200004 |
| Harsh     |   345243200005 |
| Tejas     |   345242300001 |
| Chitanaya |   345242300002 |
| Vaibhav   |   345242300003 |
| Rushi     |   345242300004 |
| Sartak    |   345242300005 |
+-----------+----------------+
10 rows in set (0.00 sec)

mysql> SELECT * FROM borrower;
+-----------+----------+
| cust_name | loan_no  |
+-----------+----------+
| Ved       | 10992001 |
| Manavi    | 10992002 |
| Atrava    | 10992003 |
| Chitanaya | 10994001 |
| Vaibhav   | 10994002 |
| Tejas     | 10994003 |
| Rushi     | 10995005 |
+-----------+----------+
7 rows in set (0.00 sec)